{
  "$schema": "https://json-schema.org/draft/2020-12/schema",
  "$id": "https://canvascontracts.dev/schemas/canvas.graph.v1.json",
  "title": "Canvas Graph v1",
  "type": "object",
  "required": [
    "id",
    "name",
    "nodes",
    "connections",
    "metadata"
  ],
  "properties": {
    "schema_version": {
      "type": "string",
      "const": "canvas.graph.v1"
    },
    "id": {
      "type": "string",
      "format": "uuid"
    },
    "name": {
      "type": "string",
      "minLength": 1
    },
    "description": {
      "type": [
        "string",
        "null"
      ]
    },
    "nodes": {
      "type": "array",
      "items": {
        "$ref": "#/$defs/visual_node"
      }
    },
    "connections": {
      "type": "array",
      "items": {
        "$ref": "#/$defs/connection"
      }
    },
    "metadata": {
      "type": "object",
      "additionalProperties": {
        "type": "string"
      }
    }
  },
  "additionalProperties": false,
  "$defs": {
    "position": {
      "type": "object",
      "required": [
        "x",
        "y"
      ],
      "properties": {
        "x": {
          "type": "number"
        },
        "y": {
          "type": "number"
        }
      },
      "additionalProperties": false
    },
    "size": {
      "type": "object",
      "required": [
        "width",
        "height"
      ],
      "properties": {
        "width": {
          "type": "number"
        },
        "height": {
          "type": "number"
        }
      },
      "additionalProperties": false
    },
    "port": {
      "type": "object",
      "required": [
        "id",
        "name",
        "value_type",
        "required"
      ],
      "properties": {
        "id": {
          "type": "string",
          "minLength": 1
        },
        "name": {
          "type": "string",
          "minLength": 1
        },
        "value_type": {
          "oneOf": [
            {
              "type": "string"
            },
            {
              "type": "object"
            }
          ]
        },
        "required": {
          "type": "boolean"
        },
        "description": {
          "type": [
            "string",
            "null"
          ]
        }
      },
      "additionalProperties": false
    },
    "visual_node": {
      "type": "object",
      "required": [
        "id",
        "node_type",
        "position",
        "size",
        "inputs",
        "outputs",
        "properties",
        "metadata"
      ],
      "properties": {
        "id": {
          "type": "string",
          "format": "uuid"
        },
        "node_type": {
          "type": "string",
          "minLength": 1
        },
        "position": {
          "$ref": "#/$defs/position"
        },
        "size": {
          "$ref": "#/$defs/size"
        },
        "inputs": {
          "type": "array",
          "items": {
            "$ref": "#/$defs/port"
          }
        },
        "outputs": {
          "type": "array",
          "items": {
            "$ref": "#/$defs/port"
          }
        },
        "properties": {
          "type": "object",
          "additionalProperties": true
        },
        "metadata": {
          "type": "object",
          "additionalProperties": {
            "type": "string"
          }
        }
      },
      "additionalProperties": false
    },
    "connection": {
      "type": "object",
      "required": [
        "id",
        "source_node",
        "source_port",
        "target_node",
        "target_port",
        "metadata"
      ],
      "properties": {
        "id": {
          "type": "string",
          "format": "uuid"
        },
        "source_node": {
          "type": "string",
          "format": "uuid"
        },
        "source_port": {
          "type": "string",
          "minLength": 1
        },
        "target_node": {
          "type": "string",
          "format": "uuid"
        },
        "target_port": {
          "type": "string",
          "minLength": 1
        },
        "metadata": {
          "type": "object",
          "additionalProperties": {
            "type": "string"
          }
        }
      },
      "additionalProperties": false
    }
  }
}
