{
  "id": "f0000000-0000-0000-0000-000000000001",
  "name": "DormancyOracle",
  "description": "Resurgence Protocol Dormancy Oracle",
  "nodes": [
    {
      "id": "a0000000-0000-0000-0000-000000000001",
      "node_type": "Start",
      "position": { "x": 0.0, "y": 100.0 },
      "size": { "width": 120.0, "height": 80.0 },
      "inputs": [],
      "outputs": [
        { "id": "flow_out", "name": "Flow Out", "value_type": "Flow", "required": false, "description": null }
      ],
      "properties": {},
      "metadata": {}
    },
    {
      "id": "a0000000-0000-0000-0000-000000000002",
      "node_type": "DecodeProof",
      "position": { "x": 200.0, "y": 100.0 },
      "size": { "width": 120.0, "height": 80.0 },
      "inputs": [
        { "id": "flow_in", "name": "Flow In", "value_type": "Flow", "required": true, "description": null },
        { "id": "proof_json", "name": "Proof JSON", "value_type": "String", "required": false, "description": null }
      ],
      "outputs": [
        { "id": "flow_out", "name": "Flow Out", "value_type": "Flow", "required": false, "description": null },
        { "id": "chain_id", "name": "Chain ID", "value_type": "String", "required": false, "description": null },
        { "id": "address", "name": "Address", "value_type": "String", "required": false, "description": null },
        { "id": "dormant_since_block", "name": "Dormant Since Block", "value_type": "Integer", "required": false, "description": null }
      ],
      "properties": {},
      "metadata": {}
    },
    {
      "id": "a0000000-0000-0000-0000-000000000003",
      "node_type": "VerifySignature",
      "position": { "x": 400.0, "y": 100.0 },
      "size": { "width": 120.0, "height": 80.0 },
      "inputs": [
        { "id": "flow_in", "name": "Flow In", "value_type": "Flow", "required": true, "description": null },
        { "id": "message", "name": "Message", "value_type": "Bytes", "required": false, "description": null },
        { "id": "signature", "name": "Signature", "value_type": "Bytes", "required": false, "description": null },
        { "id": "public_key", "name": "Public Key", "value_type": "Bytes", "required": false, "description": null }
      ],
      "outputs": [
        { "id": "flow_out", "name": "Flow Out", "value_type": "Flow", "required": false, "description": null },
        { "id": "result", "name": "Result", "value_type": "Boolean", "required": false, "description": null }
      ],
      "properties": {},
      "metadata": {}
    },
    {
      "id": "a0000000-0000-0000-0000-000000000005",
      "node_type": "If",
      "position": { "x": 600.0, "y": 100.0 },
      "size": { "width": 100.0, "height": 60.0 },
      "inputs": [
        { "id": "condition", "name": "Condition", "value_type": "Boolean", "required": true, "description": null },
        { "id": "flow_in", "name": "Flow In", "value_type": "Flow", "required": true, "description": null }
      ],
      "outputs": [
        { "id": "true_flow", "name": "True Flow", "value_type": "Flow", "required": false, "description": null },
        { "id": "false_flow", "name": "False Flow", "value_type": "Flow", "required": false, "description": null }
      ],
      "properties": { "condition": true },
      "metadata": {}
    },
    {
      "id": "a0000000-0000-0000-0000-000000000006",
      "node_type": "WriteStorage",
      "position": { "x": 800.0, "y": 100.0 },
      "size": { "width": 120.0, "height": 80.0 },
      "inputs": [
        { "id": "flow_in", "name": "Flow In", "value_type": "Flow", "required": true, "description": null },
        { "id": "key", "name": "Key", "value_type": "String", "required": false, "description": null },
        { "id": "value", "name": "Value", "value_type": "Bytes", "required": false, "description": null }
      ],
      "outputs": [],
      "properties": { "key": "attestations" },
      "metadata": {}
    },
    {
      "id": "a0000000-0000-0000-0000-000000000007",
      "node_type": "End",
      "position": { "x": 1000.0, "y": 100.0 },
      "size": { "width": 120.0, "height": 80.0 },
      "inputs": [
        { "id": "flow_in", "name": "Flow In", "value_type": "Flow", "required": true, "description": null }
      ],
      "outputs": [],
      "properties": {},
      "metadata": {}
    }
  ],
  "connections": [
    {
      "id": "c0000000-0000-0000-0000-000000000001",
      "source_node": "a0000000-0000-0000-0000-000000000001",
      "source_port": "flow_out",
      "target_node": "a0000000-0000-0000-0000-000000000002",
      "target_port": "flow_in",
      "metadata": {}
    },
    {
      "id": "c0000000-0000-0000-0000-000000000002",
      "source_node": "a0000000-0000-0000-0000-000000000002",
      "source_port": "flow_out",
      "target_node": "a0000000-0000-0000-0000-000000000003",
      "target_port": "flow_in",
      "metadata": {}
    },
    {
      "id": "c0000000-0000-0000-0000-000000000003",
      "source_node": "a0000000-0000-0000-0000-000000000003",
      "source_port": "flow_out",
      "target_node": "a0000000-0000-0000-0000-000000000005",
      "target_port": "flow_in",
      "metadata": {}
    },
    {
      "id": "c0000000-0000-0000-0000-000000000004",
      "source_node": "a0000000-0000-0000-0000-000000000003",
      "source_port": "result",
      "target_node": "a0000000-0000-0000-0000-000000000005",
      "target_port": "condition",
      "metadata": {}
    },
    {
      "id": "c0000000-0000-0000-0000-000000000005",
      "source_node": "a0000000-0000-0000-0000-000000000005",
      "source_port": "true_flow",
      "target_node": "a0000000-0000-0000-0000-000000000006",
      "target_port": "flow_in",
      "metadata": {}
    },
    {
      "id": "c0000000-0000-0000-0000-000000000006",
      "source_node": "a0000000-0000-0000-0000-000000000005",
      "source_port": "false_flow",
      "target_node": "a0000000-0000-0000-0000-000000000007",
      "target_port": "flow_in",
      "metadata": {}
    }
  ],
  "metadata": {}
}
